{
  "$schema": "http://json-schema.org/draft-07/schema#",
  "type": "object",
  "properties": {
    "account_groups": {
      "type": "object",
      "patternProperties": {
        "^[a-zA-Z0-9_]+$": {
          "type": "array",
          "items": {
            "type": "string"
          },
          "minItems": 1
        }
      },
      "additionalProperties": false,
      "minProperties": 1
    },
    "llm_instructions": {
      "type": "object",
      "patternProperties": {
        "^[a-zA-Z0-9_]+$": {
          "type": "string"
        }
      },
      "additionalProperties": false,
      "minProperties": 1
    },
    "output_format": {
      "type": "string",
      "enum": ["json", "csv", "text"]
    },
    "output_destination": {
      "type": "string"
    },
    "update_interval": {
      "type": "integer",
      "minimum": 60
    }
  },
  "required": ["account_groups", "llm_instructions", "output_format", "output_destination", "update_interval"]
}